[
  {
    "id": "TS001",
    "name": "Classic Black Crewneck T-Shirt",
    "category": "tshirt",
    "brand": "Urban Wear",
    "price": 799,
    "currency": "INR",
    "sizes": ["S", "M", "L", "XL"],
    "colors": ["Black"],
    "material": "100% Premium Cotton",
    "fit": "regular",
    "style": "casual",
    "occasion": "Daily Wear",
    "gender": "unisex",
    "season": "all-season",
    "image": "/assets/products/tshirts/ts001.jpg",
    "thumbnail": "/assets/products/tshirts/ts001_thumb.jpg",
    "description": "Soft breathable cotton t-shirt with reinforced crew neck and classic fit.",
    "rating": 4.5,
    "stock": 35,
    "tags": ["tshirt", "cotton", "black", "basic", "crewneck"],
    "isAvailable": true,
    "createdAt": "2026-01-15T10:00:00Z",
    "updatedAt": "2026-01-15T10:00:00Z"
  },
  {
    "id": "TS002",
    "name": "Oversized Vintage Graphic Tee",
    "category": "tshirt",
    "brand": "Street Culture",
    "price": 1199,
    "currency": "INR",
    "sizes": ["M", "L", "XL"],
    "colors": ["Washed Grey", "Off-White"],
    "material": "Heavyweight Cotton",
    "fit": "oversized",
    "style": "streetwear",
    "occasion": "Casual Outing",
    "gender": "unisex",
    "season": "summer",
    "image": "/assets/products/tshirts/ts002.jpg",
    "thumbnail": "/assets/products/tshirts/ts002_thumb.jpg",
    "description": "Heavyweight streetwear oversized graphic t-shirt with retro chest print.",
    "rating": 4.8,
    "stock": 20,
    "tags": ["tshirt", "streetwear", "oversized", "graphic", "vintage"],
    "isAvailable": true,
    "createdAt": "2026-01-16T11:30:00Z",
    "updatedAt": "2026-01-16T11:30:00Z"
  },
  {
    "id": "TS003",
    "name": "Slim Fit Performance Polo T-Shirt",
    "category": "tshirt",
    "brand": "ActivePro",
    "price": 1499,
    "currency": "INR",
    "sizes": ["S", "M", "L"],
    "colors": ["Navy Blue", "White"],
    "material": "Polyester Cotton Blend",
    "fit": "slim",
    "style": "sports",
    "occasion": "Sports & Leisure",
    "gender": "men",
    "season": "summer",
    "image": "/assets/products/tshirts/ts003.jpg",
    "thumbnail": "/assets/products/tshirts/ts003_thumb.jpg",
    "description": "Moisture-wicking athletic polo tee designed for active motion and maximum comfort.",
    "rating": 4.3,
    "stock": 15,
    "tags": ["tshirt", "polo", "slimfit", "sportswear", "performance"],
    "isAvailable": true,
    "createdAt": "2026-01-17T09:15:00Z",
    "updatedAt": "2026-01-17T09:15:00Z"
  },
  {
    "id": "SH001",
    "name": "Crisp Oxford Cotton Formal Shirt",
    "category": "shirt",
    "brand": "Executive Style",
    "price": 1999,
    "currency": "INR",
    "sizes": ["38", "40", "42", "44"],
    "colors": ["White", "Light Blue"],
    "material": "100% Oxford Cotton",
    "fit": "slim",
    "style": "formal",
    "occasion": "Office & Meetings",
    "gender": "men",
    "season": "all-season",
    "image": "/assets/products/shirts/sh001.jpg",
    "thumbnail": "/assets/products/shirts/sh001_thumb.jpg",
    "description": "Tailored Oxford formal shirt with button-down collar and single chest pocket.",
    "rating": 4.6,
    "stock": 25,
    "tags": ["shirt", "formal", "oxford", "office", "white"],
    "isAvailable": true,
    "createdAt": "2026-01-18T14:20:00Z",
    "updatedAt": "2026-01-18T14:20:00Z"
  },
  {
    "id": "SH002",
    "name": "Casual Printed Cuban Collar Linen Shirt",
    "category": "shirt",
    "brand": "Breeze Casuals",
    "price": 1699,
    "currency": "INR",
    "sizes": ["S", "M", "L", "XL"],
    "colors": ["Olive Green", "Beige"],
    "material": "Linen Cotton Blend",
    "fit": "relaxed",
    "style": "casual",
    "occasion": "Vacation & Beach",
    "gender": "men",
    "season": "summer",
    "image": "/assets/products/shirts/sh002.jpg",
    "thumbnail": "/assets/products/shirts/sh002_thumb.jpg",
    "description": "Lightweight breathable linen blend shirt with stylish resort cuban collar.",
    "rating": 4.4,
    "stock": 18,
    "tags": ["shirt", "linen", "cuban collar", "summer", "vacation"],
    "isAvailable": true,
    "createdAt": "2026-01-19T16:00:00Z",
    "updatedAt": "2026-01-19T16:00:00Z"
  },
  {
    "id": "SH003",
    "name": "Denim Button-Down Overshirt",
    "category": "shirt",
    "brand": "Rugged Denim Co.",
    "price": 2499,
    "currency": "INR",
    "sizes": ["M", "L", "XL"],
    "colors": ["Indigowash Blue"],
    "material": "100% Cotton Denim",
    "fit": "regular",
    "style": "streetwear",
    "occasion": "Casual Outing",
    "gender": "unisex",
    "season": "monsoon",
    "image": "/assets/products/shirts/sh003.jpg",
    "thumbnail": "/assets/products/shirts/sh003_thumb.jpg",
    "description": "Durable cotton denim overshirt featuring dual flap pockets and vintage copper buttons.",
    "rating": 4.7,
    "stock": 12,
    "tags": ["shirt", "denim", "overshirt", "streetwear", "blue"],
    "isAvailable": true,
    "createdAt": "2026-01-20T12:10:00Z",
    "updatedAt": "2026-01-20T12:10:00Z"
  },
  {
    "id": "JN001",
    "name": "Slim Fit Stretchable Blue Jeans",
    "category": "jeans",
    "brand": "Denim Craft",
    "price": 2299,
    "currency": "INR",
    "sizes": ["30", "32", "34", "36"],
    "colors": ["Dark Blue Wash"],
    "material": "98% Cotton 2% Elastane",
    "fit": "slim",
    "style": "casual",
    "occasion": "Daily Wear",
    "gender": "men",
    "season": "all-season",
    "image": "/assets/products/jeans/jn001.jpg",
    "thumbnail": "/assets/products/jeans/jn001_thumb.jpg",
    "description": "Classic 5-pocket slim fit jeans crafted with stretch elastane for flexibility.",
    "rating": 4.6,
    "stock": 40,
    "tags": ["jeans", "denim", "slimfit", "stretchable", "blue"],
    "isAvailable": true,
    "createdAt": "2026-01-21T08:45:00Z",
    "updatedAt": "2026-01-21T08:45:00Z"
  },
  {
    "id": "JN002",
    "name": "Baggy High-Waisted Carpenter Jeans",
    "category": "jeans",
    "brand": "Street Culture",
    "price": 2799,
    "currency": "INR",
    "sizes": ["28", "30", "32", "34"],
    "colors": ["Light Wash Blue", "Black"],
    "material": "Rigid Cotton Denim",
    "fit": "relaxed",
    "style": "streetwear",
    "occasion": "Streetwear",
    "gender": "unisex",
    "season": "all-season",
    "image": "/assets/products/jeans/jn002.jpg",
    "thumbnail": "/assets/products/jeans/jn002_thumb.jpg",
    "description": "Relaxed baggy carpenter jeans with side tool loop and utility pockets.",
    "rating": 4.9,
    "stock": 22,
    "tags": ["jeans", "baggy", "carpenter", "relaxed", "streetwear"],
    "isAvailable": true,
    "createdAt": "2026-01-22T10:30:00Z",
    "updatedAt": "2026-01-22T10:30:00Z"
  },
  {
    "id": "JN003",
    "name": "Straight Leg Vintage Washed Jeans",
    "category": "jeans",
    "brand": "Heritage Denim",
    "price": 2599,
    "currency": "INR",
    "sizes": ["30", "32", "34", "36"],
    "colors": ["Medium Wash Blue"],
    "material": "100% Organic Cotton Denim",
    "fit": "regular",
    "style": "casual",
    "occasion": "Weekend Outing",
    "gender": "men",
    "season": "all-season",
    "image": "/assets/products/jeans/jn003.jpg",
    "thumbnail": "/assets/products/jeans/jn003_thumb.jpg",
    "description": "Timeless straight-cut denim jeans with authentic vintage fading and whiskering.",
    "rating": 4.4,
    "stock": 30,
    "tags": ["jeans", "straight", "vintage", "organic", "regular"],
    "isAvailable": true,
    "createdAt": "2026-01-23T15:00:00Z",
    "updatedAt": "2026-01-23T15:00:00Z"
  },
  {
    "id": "JK001",
    "name": "Fleece Lined Puffer Winter Jacket",
    "category": "jacket",
    "brand": "Nordic Shield",
    "price": 4499,
    "currency": "INR",
    "sizes": ["M", "L", "XL"],
    "colors": ["Matte Black", "Olive"],
    "material": "Nylon Shell & Fleece Lining",
    "fit": "regular",
    "style": "sports",
    "occasion": "Travel & Cold Weather",
    "gender": "unisex",
    "season": "winter",
    "image": "/assets/products/jackets/jk001.jpg",
    "thumbnail": "/assets/products/jackets/jk001_thumb.jpg",
    "description": "Insulated weather-resistant puffer jacket featuring high collar thermal lining.",
    "rating": 4.8,
    "stock": 14,
    "tags": ["jacket", "puffer", "winter", "black", "insulated"],
    "isAvailable": true,
    "createdAt": "2026-01-24T11:20:00Z",
    "updatedAt": "2026-01-24T11:20:00Z"
  },
  {
    "id": "JK002",
    "name": "Classic Leather Biker Jacket",
    "category": "jacket",
    "brand": "Rebel Outerwear",
    "price": 6999,
    "currency": "INR",
    "sizes": ["S", "M", "L"],
    "colors": ["Dark Brown", "Black"],
    "material": "Faux Leather & Polyester",
    "fit": "slim",
    "style": "streetwear",
    "occasion": "Night Out",
    "gender": "men",
    "season": "winter",
    "image": "/assets/products/jackets/jk002.jpg",
    "thumbnail": "/assets/products/jackets/jk002_thumb.jpg",
    "description": "Asymmetric zip leather biker jacket with silver hardware and quilted shoulder panels.",
    "rating": 4.7,
    "stock": 8,
    "tags": ["jacket", "biker", "leather", "streetwear", "stylish"],
    "isAvailable": true,
    "createdAt": "2026-01-25T17:40:00Z",
    "updatedAt": "2026-01-25T17:40:00Z"
  },
  {
    "id": "JK003",
    "name": "Waterproof Windbreaker Rain Jacket",
    "category": "jacket",
    "brand": "ActivePro",
    "price": 2999,
    "currency": "INR",
    "sizes": ["S", "M", "L", "XL"],
    "colors": ["Neon Yellow", "Black"],
    "material": "100% Ripstop Polyester",
    "fit": "regular",
    "style": "sports",
    "occasion": "Outdoor & Trekking",
    "gender": "unisex",
    "season": "monsoon",
    "image": "/assets/products/jackets/jk003.jpg",
    "thumbnail": "/assets/products/jackets/jk003_thumb.jpg",
    "description": "Ultra-lightweight packable rain windbreaker jacket with reflective safety strips.",
    "rating": 4.5,
    "stock": 25,
    "tags": ["jacket", "windbreaker", "waterproof", "monsoon", "outdoor"],
    "isAvailable": true,
    "createdAt": "2026-01-26T09:00:00Z",